{
  "muse_version": "0.1.0",
  "metadata": {
    "id": "01J9QR4T8V0W2X6Y8Z0A2C4E6G",
    "title": "Night Circuit",
    "composer": { "name": "Muse Examples", "id": "muse:examples" },
    "created": "2026-08-22T00:00:00Z",
    "license": {
      "renditions": "presets-only",
      "attribution": "required",
      "commercial": true
    },
    "provenance": [
      {
        "event": "authored",
        "actor": "muse-examples",
        "at": "2026-08-22T00:00:00Z",
        "ai": true,
        "notes": "Authored as the full stress-test example for Batch 1 (#13)."
      }
    ]
  },
  "globals": {
    "tempo": { "bpm": 96, "range": [84, 112], "feel": "straight" },
    "meter": { "beats": [3, 3, 2], "unit": 8 },
    "key": { "tonic": "D", "mode": "dorian" },
    "duration_bars": 64
  },
  "material": {
    "motifs": [
      {
        "id": "motif.a",
        "kind": "pitch_rhythm",
        "pitches": ["D4", "F4", "A4", "G4"],
        "durations": [0.5, 0.5, 1.0, 1.0],
        "contour": "up-up-down",
        "tags": ["primary", "opening"]
      },
      {
        "id": "motif.b",
        "kind": "rhythm",
        "durations": [0.25, 0.25, 0.5],
        "tags": ["secondary"]
      }
    ],
    "themes": [
      {
        "id": "theme.1",
        "phrases": [
          { "motifs": ["motif.a", "motif.a#seq(+2)"] },
          { "motifs": ["motif.a#inv", "motif.b"] }
        ],
        "cadence": "half"
      }
    ],
    "rhythms": [
      { "id": "groove.1", "pattern": [1, 0, 0.75, 0, 1, 0, 0.75, 0.25], "grid": "8n" }
    ],
    "harmony": {
      "progressions": [
        { "id": "prog.verse", "chords": ["Dm7", "G7", "Cmaj7", "Am7"], "bars_per_chord": 1 },
        { "id": "prog.chorus", "chords": ["Bbmaj7", "C", "Dm7"], "bars_per_chord": 2 }
      ],
      "vocabulary": "diatonic-plus-bVII"
    }
  },
  "form": {
    "sections": [
      {
        "id": "verse.1",
        "role": "verse",
        "bars": 16,
        "uses": [{ "ref": "theme.1", "variation": "plain" }],
        "harmony": "prog.verse",
        "energy": 0.4
      },
      {
        "id": "chorus.1",
        "role": "chorus",
        "bars": 8,
        "uses": [{ "ref": "theme.1", "variation": "developed, ornamented" }],
        "harmony": "prog.chorus",
        "energy": 0.9
      },
      {
        "id": "bridge.cadenza",
        "role": "cadenza",
        "bars": 4,
        "uses": [{ "ref": "motif.a#inv", "variation": "improvisatory" }],
        "energy": 0.6
      }
    ],
    "order": ["verse.1", "chorus.1", "verse.1", "chorus.1", "bridge.cadenza", "chorus.1"],
    "repetition": { "verse.1": { "min": 2, "max": 4 } }
  },
  "constraints": {
    "must_contain": ["motif.a"],
    "must_not": [{ "kind": "modulation_beyond", "semitones": 3 }],
    "tempo_lock": { "chorus.1": [92, 104] },
    "register": { "theme.1": ["C4", "A5"] },
    "structure": { "form_deviation": "none" }
  },
  "renditions": [
    {
      "id": "r.synthwave",
      "name": "Midnight Drive",
      "style": {
        "genre": "synthwave",
        "era": "1984",
        "references": ["arpeggiated bass", "gated reverb drums"]
      },
      "params": {
        "tempo_bpm": 100,
        "instrumentation": ["analog synth", "drum machine"],
        "density": 0.7,
        "swing": 0.0
      },
      "author": { "name": "Muse Examples" }
    },
    {
      "id": "r.quartet",
      "name": "Late Set",
      "style": { "genre": "jazz quartet", "era": "1959" },
      "params": {
        "tempo_bpm": 88,
        "instrumentation": ["piano", "upright bass", "brushes", "tenor sax"],
        "swing": 0.62
      },
      "author": { "name": "Muse Examples" }
    }
  ],
  "extensions": {
    "engine.audiocraft": { "cfg": 3.5 }
  }
}
