{
  "muse_version": "0.1.0",
  "metadata": {
    "id": "muse:work:01M0N2MX0WPR6XQBF59G547EWH",
    "title": "bwv26.6",
    "composer": {
      "name": "unknown (imported)"
    },
    "created": "2026-08-22T15:50:20.446Z",
    "license": {
      "renditions": "closed"
    },
    "provenance": [
      {
        "event": "import",
        "actor": "importer",
        "at": "2026-08-22T15:50:20.446Z",
        "ai": false,
        "notes": "source: bwv26.6.mxl (musicxml)"
      }
    ]
  },
  "globals": {
    "tempo": {
      "bpm": 120
    },
    "duration_bars": 10,
    "meter": {
      "beats": 4,
      "unit": 4
    },
    "key": {
      "tonic": "A",
      "mode": "minor"
    }
  },
  "renditions": [
    {
      "id": "r.default",
      "name": "Default",
      "params": {
        "tempo_bpm": 120,
        "instrumentation": [
          "Soprano",
          "Alto",
          "Tenor",
          "Bass"
        ]
      },
      "author": {
        "name": "unknown (imported)"
      }
    }
  ],
  "extensions": {
    "importer": {
      "inferred": [
        {
          "path": "globals.tempo.bpm",
          "reason": "no tempo in source; defaulted to 120"
        },
        {
          "path": "globals.key",
          "reason": "mid-piece key changes dropped (spec v0)"
        },
        {
          "path": "material.motifs",
          "reason": "heuristic extraction: 8 repeated interval/duration pattern(s) (≥3 notes, ≥2 occurrences, transposition counts)"
        },
        {
          "path": "material.themes",
          "reason": "heuristic assembly: 2 theme(s) chained from motifs by suffix/prefix overlap — phrase structure needs cleanup"
        }
      ]
    }
  },
  "material": {
    "motifs": [
      {
        "id": "motif.1",
        "kind": "pitch_rhythm",
        "pitches": [
          "C#4",
          "D4",
          "E4",
          "C#4",
          "D4",
          "D4",
          "D4",
          "C#4",
          "D4",
          "A3"
        ],
        "durations": [
          0.5,
          0.5,
          0.5,
          0.5,
          1,
          1,
          1,
          1,
          1,
          1
        ]
      },
      {
        "id": "motif.2",
        "kind": "pitch_rhythm",
        "pitches": [
          "C#4",
          "D4",
          "E4",
          "C#4",
          "D4",
          "D4",
          "D4",
          "C#4",
          "D4"
        ],
        "durations": [
          0.5,
          0.5,
          0.5,
          0.5,
          1,
          1,
          1,
          1,
          1
        ]
      },
      {
        "id": "motif.3",
        "kind": "pitch_rhythm",
        "pitches": [
          "D4",
          "E4",
          "C#4",
          "D4",
          "D4",
          "D4",
          "C#4",
          "D4",
          "A3"
        ],
        "durations": [
          0.5,
          0.5,
          0.5,
          1,
          1,
          1,
          1,
          1,
          1
        ]
      },
      {
        "id": "motif.4",
        "kind": "pitch_rhythm",
        "pitches": [
          "C#4",
          "D4",
          "E4",
          "C#4",
          "D4",
          "D4",
          "D4",
          "C#4"
        ],
        "durations": [
          0.5,
          0.5,
          0.5,
          0.5,
          1,
          1,
          1,
          1
        ]
      },
      {
        "id": "motif.5",
        "kind": "pitch_rhythm",
        "pitches": [
          "D4",
          "E4",
          "C#4",
          "D4",
          "D4",
          "D4",
          "C#4",
          "D4"
        ],
        "durations": [
          0.5,
          0.5,
          0.5,
          1,
          1,
          1,
          1,
          1
        ]
      },
      {
        "id": "motif.6",
        "kind": "pitch_rhythm",
        "pitches": [
          "E4",
          "C#4",
          "D4",
          "D4",
          "D4",
          "C#4",
          "D4",
          "A3"
        ],
        "durations": [
          0.5,
          0.5,
          1,
          1,
          1,
          1,
          1,
          1
        ]
      },
      {
        "id": "motif.7",
        "kind": "pitch_rhythm",
        "pitches": [
          "A4",
          "G4",
          "G4",
          "E4",
          "F#4",
          "G4",
          "G4"
        ],
        "durations": [
          0.5,
          0.5,
          0.5,
          0.5,
          1,
          1,
          1
        ]
      },
      {
        "id": "motif.8",
        "kind": "pitch_rhythm",
        "pitches": [
          "C#4",
          "D4",
          "E4",
          "C#4",
          "D4",
          "D4",
          "D4"
        ],
        "durations": [
          0.5,
          0.5,
          0.5,
          0.5,
          1,
          1,
          1
        ]
      }
    ],
    "themes": [
      {
        "id": "theme.1",
        "phrases": [
          {
            "motifs": [
              "motif.2",
              "motif.3"
            ]
          }
        ]
      },
      {
        "id": "theme.2",
        "phrases": [
          {
            "motifs": [
              "motif.4",
              "motif.5",
              "motif.6"
            ]
          }
        ]
      }
    ]
  }
}