{
  "muse_version": "0.1.0",
  "metadata": {
    "id": "muse:work:01M0MV2W73Z91SCFZ57NX27VDT",
    "title": "bwv292",
    "composer": {
      "name": "unknown (imported)"
    },
    "created": "2026-08-22T13:38:09.766Z",
    "license": {
      "renditions": "closed"
    },
    "provenance": [
      {
        "event": "import",
        "actor": "importer",
        "at": "2026-08-22T13:38:09.766Z",
        "ai": false,
        "notes": "source: bwv292.mxl (musicxml)"
      }
    ]
  },
  "globals": {
    "tempo": {
      "bpm": 120
    },
    "duration_bars": 14,
    "meter": {
      "beats": 4,
      "unit": 4
    },
    "key": {
      "tonic": "C",
      "mode": "major"
    }
  },
  "renditions": [
    {
      "id": "r.default",
      "name": "Default",
      "params": {
        "tempo_bpm": 120,
        "instrumentation": [
          "Soprano",
          "Alto",
          "Tenor",
          "Bass"
        ]
      },
      "author": {
        "name": "unknown (imported)"
      }
    }
  ],
  "extensions": {
    "importer": {
      "inferred": [
        {
          "path": "globals.tempo.bpm",
          "reason": "no tempo in source; defaulted to 120"
        },
        {
          "path": "material.motifs",
          "reason": "heuristic extraction: 8 repeated interval/duration pattern(s) (≥3 notes, ≥2 occurrences, transposition counts)"
        },
        {
          "path": "form.sections",
          "reason": "repeated bar content detected; collapsed to one custom section — role and structure need cleanup"
        }
      ]
    }
  },
  "material": {
    "motifs": [
      {
        "id": "motif.1",
        "kind": "pitch_rhythm",
        "pitches": [
          "D5",
          "C5",
          "B4",
          "A4",
          "G4",
          "G4",
          "G4",
          "A4",
          "B4",
          "C5",
          "G4",
          "G4",
          "A4",
          "G4",
          "F4",
          "E4"
        ],
        "durations": [
          1,
          1,
          1,
          2,
          2,
          1,
          1,
          1,
          1,
          1,
          1,
          2,
          1,
          1,
          1,
          1
        ]
      },
      {
        "id": "motif.2",
        "kind": "pitch_rhythm",
        "pitches": [
          "D5",
          "C5",
          "B4",
          "A4",
          "G4",
          "G4",
          "G4",
          "A4",
          "B4",
          "C5",
          "G4",
          "G4",
          "A4",
          "G4",
          "F4"
        ],
        "durations": [
          1,
          1,
          1,
          2,
          2,
          1,
          1,
          1,
          1,
          1,
          1,
          2,
          1,
          1,
          1
        ]
      },
      {
        "id": "motif.3",
        "kind": "pitch_rhythm",
        "pitches": [
          "C5",
          "B4",
          "A4",
          "G4",
          "G4",
          "G4",
          "A4",
          "B4",
          "C5",
          "G4",
          "G4",
          "A4",
          "G4",
          "F4",
          "E4"
        ],
        "durations": [
          1,
          1,
          2,
          2,
          1,
          1,
          1,
          1,
          1,
          1,
          2,
          1,
          1,
          1,
          1
        ]
      },
      {
        "id": "motif.4",
        "kind": "pitch_rhythm",
        "pitches": [
          "G4",
          "F#4",
          "G4",
          "F#4",
          "E4",
          "A4",
          "D4",
          "C4",
          "D4",
          "E4",
          "C4",
          "A3",
          "D4",
          "C4",
          "B3"
        ],
        "durations": [
          1,
          0.5,
          0.25,
          0.25,
          0.5,
          0.5,
          0.5,
          0.25,
          0.25,
          0.5,
          0.5,
          0.5,
          0.25,
          0.25,
          2
        ]
      },
      {
        "id": "motif.5",
        "kind": "pitch_rhythm",
        "pitches": [
          "D5",
          "C5",
          "B4",
          "A4",
          "G4",
          "G4",
          "G4",
          "A4",
          "B4",
          "C5",
          "G4",
          "G4",
          "A4",
          "G4"
        ],
        "durations": [
          1,
          1,
          1,
          2,
          2,
          1,
          1,
          1,
          1,
          1,
          1,
          2,
          1,
          1
        ]
      },
      {
        "id": "motif.6",
        "kind": "pitch_rhythm",
        "pitches": [
          "C5",
          "B4",
          "A4",
          "G4",
          "G4",
          "G4",
          "A4",
          "B4",
          "C5",
          "G4",
          "G4",
          "A4",
          "G4",
          "F4"
        ],
        "durations": [
          1,
          1,
          2,
          2,
          1,
          1,
          1,
          1,
          1,
          1,
          2,
          1,
          1,
          1
        ]
      },
      {
        "id": "motif.7",
        "kind": "pitch_rhythm",
        "pitches": [
          "B4",
          "A4",
          "G4",
          "G4",
          "G4",
          "A4",
          "B4",
          "C5",
          "G4",
          "G4",
          "A4",
          "G4",
          "F4",
          "E4"
        ],
        "durations": [
          1,
          2,
          2,
          1,
          1,
          1,
          1,
          1,
          1,
          2,
          1,
          1,
          1,
          1
        ]
      },
      {
        "id": "motif.8",
        "kind": "pitch_rhythm",
        "pitches": [
          "G4",
          "F#4",
          "G4",
          "F#4",
          "E4",
          "A4",
          "D4",
          "C4",
          "D4",
          "E4",
          "C4",
          "A3",
          "D4",
          "C4"
        ],
        "durations": [
          1,
          0.5,
          0.25,
          0.25,
          0.5,
          0.5,
          0.5,
          0.25,
          0.25,
          0.5,
          0.5,
          0.5,
          0.25,
          0.25
        ]
      }
    ]
  },
  "form": {
    "sections": [
      {
        "id": "section.1",
        "role": "custom",
        "bars": 14
      }
    ],
    "order": [
      "section.1"
    ]
  }
}