{
  "muse_version": "0.1.0",
  "metadata": {
    "id": "muse:work:01M0N2MXCX9VKK0CKME63Z32VD",
    "title": "bwv269",
    "composer": {
      "name": "unknown (imported)"
    },
    "created": "2026-08-22T15:50:20.831Z",
    "license": {
      "renditions": "closed"
    },
    "provenance": [
      {
        "event": "import",
        "actor": "importer",
        "at": "2026-08-22T15:50:20.831Z",
        "ai": false,
        "notes": "source: bwv269.mxl (musicxml)"
      }
    ]
  },
  "globals": {
    "tempo": {
      "bpm": 120
    },
    "duration_bars": 21,
    "meter": {
      "beats": 3,
      "unit": 4
    },
    "key": {
      "tonic": "G",
      "mode": "major"
    }
  },
  "renditions": [
    {
      "id": "r.default",
      "name": "Default",
      "params": {
        "tempo_bpm": 120,
        "instrumentation": [
          "Soprano",
          "Alto",
          "Tenor",
          "Bass"
        ]
      },
      "author": {
        "name": "unknown (imported)"
      }
    }
  ],
  "extensions": {
    "importer": {
      "inferred": [
        {
          "path": "globals.tempo.bpm",
          "reason": "no tempo in source; defaulted to 120"
        },
        {
          "path": "material.motifs",
          "reason": "heuristic extraction: 8 repeated interval/duration pattern(s) (≥3 notes, ≥2 occurrences, transposition counts)"
        },
        {
          "path": "material.themes",
          "reason": "heuristic assembly: 3 theme(s) chained from motifs by suffix/prefix overlap — phrase structure needs cleanup"
        },
        {
          "path": "form.sections[].uses",
          "reason": "sections wired to assembled themes — placement is whole-section, not per-occurrence"
        },
        {
          "path": "form.sections",
          "reason": "repeated bar content detected; collapsed to one custom section — role and structure need cleanup"
        }
      ]
    }
  },
  "material": {
    "motifs": [
      {
        "id": "motif.1",
        "kind": "pitch_rhythm",
        "pitches": [
          "G4",
          "A4",
          "B4",
          "A4",
          "B4",
          "D5",
          "C5",
          "B4",
          "A4",
          "G4"
        ],
        "durations": [
          1.5,
          0.5,
          1,
          2,
          1,
          2,
          1,
          1,
          2,
          2
        ]
      },
      {
        "id": "motif.2",
        "kind": "pitch_rhythm",
        "pitches": [
          "G4",
          "A4",
          "B4",
          "A4",
          "B4",
          "D5",
          "C5",
          "B4",
          "A4"
        ],
        "durations": [
          1.5,
          0.5,
          1,
          2,
          1,
          2,
          1,
          1,
          2
        ]
      },
      {
        "id": "motif.3",
        "kind": "pitch_rhythm",
        "pitches": [
          "A4",
          "B4",
          "A4",
          "B4",
          "D5",
          "C5",
          "B4",
          "A4",
          "G4"
        ],
        "durations": [
          0.5,
          1,
          2,
          1,
          2,
          1,
          1,
          2,
          2
        ]
      },
      {
        "id": "motif.4",
        "kind": "pitch_rhythm",
        "pitches": [
          "G4",
          "A4",
          "B4",
          "A4",
          "B4",
          "D5",
          "C5",
          "B4"
        ],
        "durations": [
          1.5,
          0.5,
          1,
          2,
          1,
          2,
          1,
          1
        ]
      },
      {
        "id": "motif.5",
        "kind": "pitch_rhythm",
        "pitches": [
          "A4",
          "B4",
          "A4",
          "B4",
          "D5",
          "C5",
          "B4",
          "A4"
        ],
        "durations": [
          0.5,
          1,
          2,
          1,
          2,
          1,
          1,
          2
        ]
      },
      {
        "id": "motif.6",
        "kind": "pitch_rhythm",
        "pitches": [
          "B4",
          "A4",
          "B4",
          "D5",
          "C5",
          "B4",
          "A4",
          "G4"
        ],
        "durations": [
          1,
          2,
          1,
          2,
          1,
          1,
          2,
          2
        ]
      },
      {
        "id": "motif.7",
        "kind": "pitch_rhythm",
        "pitches": [
          "G4",
          "A4",
          "B4",
          "A4",
          "B4",
          "D5",
          "C5"
        ],
        "durations": [
          1.5,
          0.5,
          1,
          2,
          1,
          2,
          1
        ]
      },
      {
        "id": "motif.8",
        "kind": "pitch_rhythm",
        "pitches": [
          "A4",
          "B4",
          "A4",
          "B4",
          "D5",
          "C5",
          "B4"
        ],
        "durations": [
          0.5,
          1,
          2,
          1,
          2,
          1,
          1
        ]
      }
    ],
    "themes": [
      {
        "id": "theme.1",
        "phrases": [
          {
            "motifs": [
              "motif.2",
              "motif.3"
            ]
          }
        ]
      },
      {
        "id": "theme.2",
        "phrases": [
          {
            "motifs": [
              "motif.4",
              "motif.5",
              "motif.6"
            ]
          }
        ]
      },
      {
        "id": "theme.3",
        "phrases": [
          {
            "motifs": [
              "motif.7",
              "motif.8"
            ]
          }
        ]
      }
    ]
  },
  "form": {
    "sections": [
      {
        "id": "section.1",
        "role": "custom",
        "bars": 21,
        "uses": [
          {
            "ref": "theme.1"
          },
          {
            "ref": "theme.2"
          },
          {
            "ref": "theme.3"
          }
        ]
      }
    ],
    "order": [
      "section.1"
    ]
  }
}